{
  "schema": "modelbus.consumer_bridge_config.v1",
  "generated_at_utc": "2026-04-13T08:31:49Z",
  "consumer_id": "datapulse",
  "bundle_id": "datapulse.ai_surface_bus",
  "base_url": "http://127.0.0.1:56717/v1",
  "request_protocol": "responses",
  "endpoint": "/v1/responses",
  "bus_key_env": "DATAPULSE_MODELBUS_BUS_KEY",
  "tenant_env": "DATAPULSE_MODELBUS_TENANT",
  "tenant_header": "X-ModelBus-Tenant",
  "accepted_protocols": [
    "responses",
    "chat_completions"
  ],
  "accepted_modelbus_semantics": [
    "CONSTRAINED-DEPLOYED",
    "ASSURED-ACTIVE"
  ],
  "release_window": {
    "generated_at_utc": "2026-04-13T04:20:56Z",
    "release_level": "assured",
    "assured_verdict": "pass",
    "constitutional_semantics": "ASSURED-ACTIVE"
  },
  "alias_by_surface": {
    "mission_suggest": "dp.mission.suggest",
    "triage_assist": "dp.triage.assist",
    "claim_draft": "dp.claim.draft",
    "report_draft": "dp.report.draft",
    "delivery_summary": "dp.delivery.summary"
  },
  "mode_by_surface": {
    "mission_suggest": "assist",
    "triage_assist": "assist",
    "claim_draft": "review",
    "report_draft": "off",
    "delivery_summary": "assist"
  },
  "capability_packages_by_surface": {}
}
